,Title,Artist,Year,Count
0,What Lovers Do,Maroon 5 Featuring SZA,2017,14
1,Bad At Love,Halsey,2017,13
2,Love.,Kendrick Lamar Featuring Zacari,2017,23
3,Greatest Love Story,LANCO,2017,13
4,Like I Loved You,Brett Young,2017,10
5,Love So Soft,Kelly Clarkson,2017,12
6,I Could Use A Love Song,Maren Morris,2017,15
7,F**k Love,XXXTentacion Featuring Trippie Redd,2017,14
8,Love Galore,SZA Featuring Travis Scott,2017,20
9,Tell Me You Love Me,Demi Lovato,2017,1
10,Extra Luv,Future Featuring YG,2017,1
11,Love On The Brain,Rihanna,2017,22
12,Love On The Brain,Rihanna,2016,9
13,Fake Love,Drake,2017,17
14,Fake Love,Drake,2016,8
15,Let Me Love You,DJ Snake Featuring Justin Bieber,2017,14
16,Let Me Love You,DJ Snake Featuring Justin Bieber,2016,19
17,Love,Lana Del Rey,2017,2
18,Make Love,Gucci Mane & Nicki Minaj,2017,1
19,Love Me Now,John Legend,2017,11
20,Love Me Now,John Legend,2016,8
21,Love On The Weekend,John Mayer,2017,1
22,Love On The Weekend,John Mayer,2016,1
23,In The Name Of Love,Martin Garrix & Bebe Rexha,2017,5
24,In The Name Of Love,Martin Garrix & Bebe Rexha,2016,18
25,I Hate U I Love U,gnash Featuring Olivia O'Brien,2017,4
26,I Hate U I Love U,gnash Featuring Olivia O'Brien,2016,35
27,Hate U Love U,Olivia O'Brien,2017,1
28,Love To Lay,The Weeknd,2016,1
29,Luv,Tory Lanez,2016,22
30,Send My Love (To Your New Lover),Adele,2016,26
31,Send My Love (To Your New Lover),Adele,2015,1
32,American Country Love Song,Jake Owen,2016,17
33,Love Yourself,Justin Bieber,2016,37
34,Love Yourself,Justin Bieber,2015,4
35,"Huntin', Fishin' & Lovin' Every Day",Luke Bryan,2016,20
36,Love Make The World Go Round,Jennifer Lopez & Lin-Manuel Miranda,2016,1
37,What The World Needs Now Is Love,Broadway For Orlando,2016,1
38,If It Ain't Love,Jason Derulo,2016,8
39,Love Drought,Beyonce,2016,2
40,Drunk On Your Love,Brett Eldredge,2016,15
41,Let Me Love You,Ariana Grande Featuring Lil Wayne,2016,1
42,Same Old Love,Selena Gomez,2016,15
43,Same Old Love,Selena Gomez,2015,13
44,I Love This Life,LOCASH,2016,11
45,I Love This Life,LOCASH,2015,7
46,Used To Love You,Gwen Stefani,2016,5
47,Used To Love You,Gwen Stefani,2015,4
48,Somebody To Love,Jordan Smith,2016,1
49,Somebody To Love,Jordan Smith,2015,1
50,How Deep Is Your Love,Calvin Harris & Disciples,2015,20
51,I'd Just Love To Lay You Down,Barrett Baber,2015,1
52,Love Myself,Hailee Steinfeld,2015,16
53,Used To Love You Sober,Kane Brown,2015,1
54,Can't Sleep Love,Pentatonix,2015,1
55,Love Me,The 1975,2015,1
56,"I Don't Like It, I Love It",Flo Rida Featuring Robin Thicke & Verdine White,2015,14
57,Loving You Easy,Zac Brown Band,2015,17
58,Love Me Like You Do,Ellie Goulding,2015,34
59,Love You Like That,Canaan Smith,2015,20
60,Love Me Like You Mean It,Kelsea Ballerini,2015,18
61,Baby Be My Love Song,Easton Corbin,2015,16
62,Dance Like We're Making Love,Ciara,2015,1
63,Love Is Your Name,Steven Tyler,2015,1
64,I Need Your Love,"Shaggy Featuring Mohombi, Faydee, Costi",2015,8
65,She Don't Love You,Eric Paslay,2015,12
66,Nothing Without Love,Nate Ruess,2015,4
67,Nobody Love,Tori Kelly,2015,11
68,Good Lovin,Ludacris Featuring Miguel,2015,2
69,Love Me Harder,Ariana Grande & The Weeknd,2015,12
70,Love Me Harder,Ariana Grande & The Weeknd,2014,10
71,You Are In Love,Taylor Swift,2015,1
72,L.A.LOVE (la la),Fergie,2015,8
73,L.A.LOVE (la la),Fergie,2014,10
74,"Touchin, Lovin",Trey Songz Featuring Nicki Minaj,2015,5
75,"Touchin, Lovin",Trey Songz Featuring Nicki Minaj,2014,15
76,No Love,August Alsina,2015,5
77,No Love,August Alsina,2014,13
78,Wasted Love,Matt McAndrew,2015,1
79,Love Runs Out,OneRepublic,2014,20
80,Love Never Felt So Good,Michael Jackson & Justin Timberlake,2014,20
81,Who Do You Love?,YG Featuring Drake,2014,20
82,First Love,Jennifer Lopez,2014,3
83,Wild Wild Love,Pitbull Featuring G.R.L.,2014,18
84,Afire Love,Ed Sheeran,2014,1
85,Can't Help Falling In Love,Christina Grimmie,2014,1
86,Leave Your Lover,Sam Smith,2014,1
87,Wake Up Lovin' You,Craig Morgan,2014,2
88,I Can't Make You Love Me,Josh Kaufman,2014,1
89,How To Love,Christina Grimmie,2014,1
90,Drunk In Love,Beyonce Featuring Jay Z,2014,20
91,Helluva Life,Frankie Ballard,2014,18
92,Helluva Life,Frankie Ballard,2013,2
93,Love Is An Open Door,Kristen Bell & Santino Fontana,2014,4
94,Love Me Again,John Newman,2014,14
95,Love Me Again,John Newman,2013,4
96,Ordinary Love,U2,2014,2
97,Love Don't Die,The Fray,2014,9
98,Love More,Chris Brown Featuring Nicki Minaj,2014,5
99,Love More,Chris Brown Featuring Nicki Minaj,2013,21
100,I Luv This Sh*t,August Alsina Featuring Trinidad James,2014,5
101,I Luv This Sh*t,August Alsina Featuring Trinidad James,2013,15
102,Old School Love,Lupe Fiasco Featuring Ed Sheeran,2014,3
103,Old School Love,Lupe Fiasco Featuring Ed Sheeran,2013,2
104,Who You Love,John Mayer Featuring Katy Perry,2014,1
105,Who You Love,John Mayer Featuring Katy Perry,2013,1
106,True Love,P!nk Featuring Lily Allen,2013,14
107,Love Somebody,Maroon 5,2013,21
108,Make You Feel My Love,Glee Cast,2013,1
109,Same Love,Macklemore & Ryan Lewis Featuring Mary Lambert,2013,30
110,I Need Your Love,Calvin Harris Featuring Ellie Goulding,2013,25
111,Helluva Night,Ludacris,2013,1
112,LoveHate Thing,Wale Featuring Sam Dew,2013,8
113,I Love It,Icona Pop Featuring Charli XCX,2013,29
114,What About Love,Austin Mahone,2013,9
115,Love Me,Lil Wayne Featuring Drake & Future,2013,22
116,Loveeeeeee Song,Rihanna Featuring Future,2013,20
117,Love And War,Tamar Braxton,2013,18
118,Love And War,Tamar Braxton,2012,2
119,Pusher Love Girl,Justin Timberlake,2013,2
120,Stubborn Love,The Lumineers,2013,13
121,Stubborn Love,The Lumineers,2012,2
122,Love Sosa,Chief Keef,2013,13
123,Love Sosa,Chief Keef,2012,1
124,Let Me Love You (Until You Learn To Love Yourself),Ne-Yo,2013,8
125,Let Me Love You (Until You Learn To Love Yourself),Ne-Yo,2012,20
126,Let Me Love You (Until You Learn To Love Yourself),Glee Cast,2013,1
127,As Long As You Love Me (Acoustic),Justin Bieber,2013,1
128,As Long As You Love Me,Justin Bieber Featuring Big Sean,2013,3
129,As Long As You Love Me,Justin Bieber Featuring Big Sean,2012,26
130,I Want To Know What Love Is,Terry McDermott,2012,1
131,Hard To Love,Lee Brice,2012,23
132,Lovin' You Is Fun,Easton Corbin,2012,20
133,Lover's Eyes,Mumford & Sons,2012,2
134,Lover Of The Light,Mumford & Sons,2012,1
135,Enough Of No Love,Keyshia Cole Featuring Lil Wayne,2012,9
136,Time Is Love,Josh Turner,2012,25
137,Oh Love,Green Day,2012,4
138,Crew Love,Drake Featuring The Weeknd,2012,20
139,We Found Love,Rihanna Featuring Calvin Harris,2012,28
140,We Found Love,Rihanna Featuring Calvin Harris,2011,13
141,International Love,Pitbull Featuring Chris Brown,2012,19
142,International Love,Pitbull Featuring Chris Brown,2011,7
143,Sweet Love,Chris Brown,2012,1
144,Sex Ain't Better Than Love,Trey Songz,2012,6
145,Love This Life,T.I.,2012,1
146,Love On Top,Beyonce,2012,15
147,Love On Top,Beyonce,2011,5
148,Love's Gonna Make It Alright,George Strait,2012,11
149,Give Me All Your Luvin',Madonna Featuring Nicki Minaj & M.I.A.,2012,6
150,Love You Like A Love Song,Selena Gomez & The Scene,2012,12
151,Love You Like A Love Song,Selena Gomez & The Scene,2011,26
152,I Will Always Love You,Whitney Houston,2012,3
153,I Will Always Love You,Whitney Houston,1993,19
154,I Will Always Love You,Whitney Houston,1992,7
155,I Wanna Dance With Somebody (Who Loves Me),Whitney Houston,2012,2
156,I Wanna Dance With Somebody (Who Loves Me),Whitney Houston,1987,18
157,Greatest Love Of All,Whitney Houston,2012,2
158,Greatest Love Of All,Whitney Houston,1986,18
159,I'm Gonna Love You Through It,Martina McBride,2012,9
160,I'm Gonna Love You Through It,Martina McBride,2011,11
161,I Will Always Love You,Glee Cast,2012,1
162,We Found Love,Glee Cast,2012,1
163,How To Love,Lil Wayne,2011,24
164,Lessons In Love,Kaskade Featuring Neon Trees,2011,1
165,Got 2 Luv U,Sean Paul Featuring Alexis Jordan,2011,6
166,Love Don't Run,Steve Holy,2011,7
167,Love Done Gone,Billy Currington,2011,15
168,I Love You This Big,Scotty McCreery,2011,16
169,Best Love Song,T-Pain Featuring Chris Brown,2011,20
170,So In Love,Jill Scott Featuring Anthony Hamilton,2011,1
171,"I Love New York / New York, New York",Glee Cast,2011,1
172,I Can't Love You Back,Easton Corbin,2011,11
173,Love Faces,Trey Songz,2011,16
174,Tonight (I'm Lovin' You),Enrique Iglesias Featuring Ludacris & DJ Frank E,2011,22
175,Tonight (I'm Lovin' You),Enrique Iglesias Featuring Ludacris & DJ Frank E,2010,3
176,Isn't She Lovely,Glee Cast,2011,1
177,Stereo Love,Edward Maya & Vika Jigulina,2011,18
178,Stereo Love,Edward Maya & Vika Jigulina,2010,10
179,DJ Got Us Fallin' In Love,Usher Featuring Pitbull,2011,12
180,DJ Got Us Fallin' In Love,Usher Featuring Pitbull,2010,22
181,Somebody To Love,Glee Cast,2011,1
182,Somebody To Love,Glee Cast,2009,3
183,Silly Love Songs,Glee Cast,2011,1
184,Rhythm of Love,Plain White T's,2011,8
185,Rhythm of Love,Plain White T's,2010,13
186,No Love,Eminem Featuring Lil Wayne,2011,5
187,No Love,Eminem Featuring Lil Wayne,2010,15
188,Love The Way You Lie,Eminem Featuring Rihanna,2011,4
189,Love The Way You Lie,Eminem Featuring Rihanna,2010,25
190,Love Like Woe,The Ready Set,2011,3
191,Love Like Woe,The Ready Set,2010,18
192,Loving You No More,Diddy - Dirty Money Featuring Drake,2011,1
193,Loving You No More,Diddy - Dirty Money Featuring Drake,2010,1
194,When A Woman Loves,R. Kelly,2011,1
195,Letting Go (Dutty Love),Sean Kingston Featuring Nicki Minaj,2011,1
196,Letting Go (Dutty Love),Sean Kingston Featuring Nicki Minaj,2010,19
197,This Ain't No Love Song,Trace Adkins,2010,6
198,Stop! In The Name Of Love / Free Your Mind,Glee Cast,2010,1
199,One Love (People Get Ready),Glee Cast,2010,1
200,Love All Over Me,Monica,2010,17
201,If It's Love,Train,2010,20
202,Our Kind Of Love,Lady Antebellum,2010,20
203,Your Love,Nicki Minaj,2010,20
204,Find Your Love,Drake,2010,21
205,What I Did For Love,Glee Cast,2010,1
206,Love Like Crazy,Lee Brice,2010,20
207,Somebody To Love,Justin Bieber Featuring Usher,2010,18
208,"Lover, Lover",Jerrod Niemann,2010,20
209,Dumb Love,Sean Kingston,2010,1
210,Your Love Is My Drug,Ke$ha,2010,28
211,I Keep On Loving You,Reba,2010,10
212,Any Way You Want It/Lovin' Touchin' Squeezin',Glee Cast,2010,1
213,To Sir With Love,Glee Cast,2010,1
214,Keep On Lovin' You,Steel Magnolia,2010,15
215,Neutron Star Collision (Love Is Forever),Muse,2010,1
216,Love King,The-Dream,2010,3
217,"Hello, I Love You",Glee Cast,2010,1
218,Soldier Of Love,Sade,2010,11
219,Gangsta Luv,Snoop Dogg Featuring The-Dream,2010,11
220,Gangsta Luv,Snoop Dogg Featuring The-Dream,2009,8
221,Didn't You Know How Much I Loved You,Kellie Pickler,2010,2
222,Ready To Love Again,Lady Antebellum,2010,1
223,Love This Pain,Lady Antebellum,2010,1
224,Love Me,Justin Bieber,2010,1
225,Love Me,Justin Bieber,2009,3
226,Say Hey (I Love You),Michael Franti & Spearhead Featuring Cherine Anderson,2009,20
227,Endless Love,Glee Cast,2009,1
228,Only You Can Love Me This Way,Keith Urban,2009,19
229,Love Drunk,Boys Like Girls,2009,20
230,I Want To Know What Love Is,Mariah Carey,2009,6
231,Love Your Love The Most,Eric Church,2009,16
232,Closer To Love,Mat Kearney,2009,7
233,LoveGame,Lady Gaga,2009,22
234,She Is Love,Parachute,2009,7
235,When Love Takes Over,David Guetta Featuring Kelly Rowland,2009,9
236,Love Story,Taylor Swift,2009,35
237,Love Story,Taylor Swift,2008,14
238,I Love College,Asher Roth,2009,17
239,Always The Love Songs,Eli Young Band,2009,11
240,If This Isn't Love,Jennifer Hudson,2009,13
241,Love Sex Magic,Ciara Featuring Justin Timberlake,2009,12
242,Don't Think I Can't Love You,Jake Owen,2009,15
243,River Of Love,George Strait,2009,18
244,River Of Love,George Strait,2008,2
245,My Love,The-Dream Featuring Mariah Carey,2009,4
246,God Love Her,Toby Keith,2009,16
247,God Love Her,Toby Keith,2008,4
248,Love Who You Love,Rascal Flatts,2009,1
249,Love Is On Its Way,Jonas Brothers,2009,1
250,Love Lockdown,Kanye West,2009,10
251,Love Lockdown,Kanye West,2008,13
252,Love Remains The Same,Gavin Rossdale,2009,3
253,Love Remains The Same,Gavin Rossdale,2008,28
254,Lovebug,Jonas Brothers,2009,2
255,Lovebug,Jonas Brothers,2008,12
256,Love Remembers,Craig Morgan,2008,9
257,The Way I Loved You,Taylor Swift,2008,1
258,Bleeding Love,Leona Lewis,2008,39
259,I Luv Your Girl,The-Dream,2008,20
260,I'll Be Lovin' U Long Time,Mariah Carey,2008,8
261,Teenage Love Affair,Alicia Keys,2008,16
262,Love Song,Sara Bareilles,2008,34
263,Love Song,Sara Bareilles,2007,7
264,In Love With A Girl,Gavin DeGraw,2008,23
265,Love In This Club,Usher Featuring Young Jeezy,2008,25
266,Love In This Club Part II,Usher Featuring Beyonce & Lil Wayne,2008,14
267,Just Got Started Lovin' You,James Otto,2008,20
268,The Way That I Love You,Ashanti,2008,18
269,Love Don't Live Here,Lady Antebellum,2008,18
270,Love Is A Beautiful Thing,Phil Vassar,2008,17
271,Love Is Gone,David Guetta & Chris Willis,2008,1
272,Love Is Free,Sheryl Crow,2008,6
273,Love Like This,Natasha Bedingfield Featuring Sean Kingston,2008,11
274,Love Like This,Natasha Bedingfield Featuring Sean Kingston,2007,9
275,Hate That I Love You,Rihanna Featuring Ne-Yo,2008,10
276,Hate That I Love You,Rihanna Featuring Ne-Yo,2007,16
277,I Don't Wanna Be In Love (Dance Floor Anthem),Good Charlotte,2008,6
278,I Don't Wanna Be In Love (Dance Floor Anthem),Good Charlotte,2007,15
279,Me Love,Sean Kingston,2008,1
280,Me Love,Sean Kingston,2007,17
281,Falling In Love At A Coffee Shop,Landon Pigg,2008,2
282,Livin' Our Love Song,Jason Michael Carroll,2008,1
283,Livin' Our Love Song,Jason Michael Carroll,2007,16
284,LoveStoned,Justin Timberlake,2007,20
285,Love Me If You Can,Toby Keith,2007,17
286,Summer Love,Justin Timberlake,2007,20
287,You Give Love A Bad Name,Blake Lewis,2007,4
288,A Woman's Love,Alan Jackson,2007,12
289,With Love,Hilary Duff,2007,9
290,Ladies Love Country Boys,Trace Adkins,2007,18
291,Ladies Love Country Boys,Trace Adkins,2006,2
292,I Wanna Love You,Akon Featuring Snoop Dogg,2007,17
293,I Wanna Love You,Akon Featuring Snoop Dogg,2006,12
294,Runaway Love,Ludacris Featuring Mary J. Blige,2007,15
295,Runaway Love,Ludacris Featuring Mary J. Blige,2006,5
296,Love Today,MIKA,2007,1
297,My Love,Justin Timberlake Featuring T.I.,2007,14
298,My Love,Justin Timberlake Featuring T.I.,2006,15
299,I Luv It,Young Jeezy,2007,10
300,I Luv It,Young Jeezy,2006,5
301,Love Like Winter,AFI,2007,4
302,Love Like Winter,AFI,2006,1
303,Love Me Or Hate Me (F**k You!!!!),Lady Sovereign,2007,2
304,Love Me Or Hate Me (F**k You!!!!),Lady Sovereign,2006,7
305,I Loved Her First,Heartland,2007,1
306,I Loved Her First,Heartland,2006,19
307,The Carpal Tunnel Of Love,Fall Out Boy,2006,1
308,I Call It Love,Lionel Richie,2006,20
309,Love You,Jack Ingram,2006,6
310,Sexy Love,Ne-Yo,2006,22
311,I Love My B****,Busta Rhymes Featuring will.i.am & Kelis,2006,12
312,DJ Play A Love Song,Jamie Foxx Featuring Twista,2006,14
313,I Can't Unlove You,Kenny Rogers,2006,5
314,Love,Keyshia Cole,2006,19
315,Beautiful Love,The Afters,2006,7
316,I'm N Luv (Wit A Stripper),T-Pain Featuring Mike Jones,2006,19
317,I'm N Luv (Wit A Stripper),T-Pain Featuring Mike Jones,2005,1
318,Goodbye My Lover,James Blunt,2006,4
319,If It's Lovin' That You Want,Rihanna,2006,9
320,If It's Lovin' That You Want,Rihanna,2005,11
321,Like We Never Loved At All,Faith Hill,2006,8
322,Like We Never Loved At All,Faith Hill,2005,13
323,Seasons Of Love,Cast Of Rent,2006,3
324,Seasons Of Love,Cast Of Rent,2005,9
325,I Can't Stop Loving You,Kem,2005,14
326,Hate It Or Love It,The Game Featuring 50 Cent,2005,23
327,Let Me Love You,Mario,2005,26
328,Let Me Love You,Mario,2004,10
329,That's What I Love About Sunday,Craig Morgan,2005,20
330,When You Tell Me That You Love Me,American Idol Finalists Season 4,2005,4
331,She Will Be Loved,Maroon 5,2005,18
332,She Will Be Loved,Maroon 5,2004,23
333,Lovers And Friends,Lil Jon & The East Side Boyz Featuring Usher & Ludacris,2005,17
334,Lovers And Friends,Lil Jon & The East Side Boyz Featuring Usher & Ludacris,2004,5
335,Why Do You Love Me,Garbage,2005,1
336,Nothin 'Bout Love Makes Sense,LeAnn Rimes,2005,12
337,Nothin 'Bout Love Makes Sense,LeAnn Rimes,2004,7
338,Dangerously In Love,Beyonce,2005,5
339,Dangerously In Love,Beyonce,2004,15
340,In A Real Love,Phil Vassar,2005,3
341,In A Real Love,Phil Vassar,2004,17
342,Used To Love U,John Legend,2004,13
343,This Love,Maroon 5,2004,43
344,Accidentally In Love,Counting Crows,2004,20
345,Still In Love,Teena Marie Featuring Baby,2004,20
346,Love Song,311,2004,20
347,If You Ever Stop Loving Me,Montgomery Gentry,2004,20
348,Talk About Our Love,Brandy Featuring Kanye West,2004,14
349,Don't Take Your Love Away,Avant,2004,20
350,That's What She Gets For Loving Me,Brooks & Dunn,2004,14
351,Love's Divine,Seal,2004,20
352,I'm Still In Love With You,Sean Paul Featuring Sasha,2004,25
353,No Better Love,Young Gunz Featuring Rell,2004,14
354,I Love You This Much,Jimmy Wayne,2004,15
355,Baby I Love U,Jennifer Lopez,2004,4
356,Love Me Right (Oh Sheila),Angel City Featuring Lara McAllen,2004,4
357,Step In The Name Of Love,R. Kelly,2004,8
358,Step In The Name Of Love,R. Kelly,2003,19
359,Love You More,Ginuwine,2004,7
360,Love You More,Ginuwine,2003,9
361,I Love This Bar,Toby Keith,2004,3
362,I Love This Bar,Toby Keith,2003,17
363,Where Is The Love?,The Black Eyed Peas,2003,25
364,Crazy In Love,Beyonce Featuring Jay Z,2003,27
365,My Love Is Like... Wo,Mya,2003,20
366,Signs Of Love Makin',Tyrese,2003,14
367,Lovin' All Night,Patty Loveless,2003,10
368,Simply Being Loved (Somnambulist),BT,2003,3
369,Love At 1st Sight,Mary J. Blige Featuring Method Man,2003,13
370,Love You Out Loud,Rascal Flatts,2003,20
371,The Love Song,Jeff Bates,2003,12
372,In Love Wit Chu,Da Brat Featuring Cherish,2003,16
373,I Love You,Dru Hill,2003,13
374,The Game Of Love,Santana Featuring Michelle Branch,2003,24
375,The Game Of Love,Santana Featuring Michelle Branch,2002,13
376,Can't Stop Loving You,Phil Collins,2003,20
377,Blowin' Me Up (With Her Love),JC Chasez,2003,17
378,"Ma, I Don't Love Her",Clipse Featuring Faith Evans,2003,6
379,Love Of My Life (An Ode To Hip Hop),Erykah Badu Featuring Common,2003,10
380,Love Of My Life (An Ode To Hip Hop),Erykah Badu Featuring Common,2002,17
381,Thug Lovin',Ja Rule Featuring Bobby Brown,2003,4
382,Thug Lovin',Ja Rule Featuring Bobby Brown,2002,6
383,Luv U Better,LL Cool J,2003,3
384,Luv U Better,LL Cool J,2002,19
385,Like I Love You,Justin Timberlake,2003,3
386,Like I Love You,Justin Timberlake,2002,17
387,Gangsta Lovin',Eve Featuring Alicia Keys,2002,22
388,Why I Love You,B2K,2002,4
389,The One You Love,Paulina Rubio,2002,3
390,Love At First Sight,Kylie Minogue,2002,16
391,Why Don't We Fall In Love,Amerie,2002,19
392,She Loves Me Not,Papa Roach,2002,12
393,Someone To Love You,Ruff Endz,2002,20
394,You Know That I Love You,Donell Jones,2002,20
395,What's Luv?,Fat Joe Featuring Ashanti,2002,28
396,Makin' Good Love,Avant,2002,20
397,That's When I Love You,Phil Vassar,2002,20
398,I Love You,Faith Evans,2002,21
399,Hey Luv (Anything),Mobb Deep Featuring 112,2002,15
400,Just Let Me Be In Love,Tracy Byrd,2002,10
401,You Gets No Love,Faith Evans,2002,7
402,You Gets No Love,Faith Evans,2001,13
403,Love Of A Woman,Travis Tritt,2002,4
404,Love Of A Woman,Travis Tritt,2001,16
405,Love Of My Life,Brian McKnight,2002,4
406,Love Of My Life,Brian McKnight,2001,16
407,I Would've Loved You Anyway,Trisha Yearwood,2001,20
408,Someone To Call My Lover,Janet,2001,20
409,Loverboy,Mariah Carey Featuring Cameo,2001,14
410,While You Loved Me,Rascal Flatts,2001,12
411,Two People Fell In Love,Brad Paisley,2001,18
412,When Somebody Loves You,Alan Jackson,2001,17
413,Love,Musiq Soulchild,2001,21
414,The Way You Love Me,Faith Hill,2001,21
415,The Way You Love Me,Faith Hill,2000,35
416,Puppy Love,Lil Bow Wow Featuring Jagged Edge,2001,7
417,Love Don't Cost A Thing,Jennifer Lopez,2001,17
418,Love Don't Cost A Thing,Jennifer Lopez,2000,4
419,Thank You For Loving Me,Bon Jovi,2001,10
420,He Loves U Not,Dream,2001,14
421,He Loves U Not,Dream,2000,14
422,This Everyday Love,Rascal Flatts,2001,12
423,This Everyday Love,Rascal Flatts,2000,2
424,I Just Wanna Love U (Give It 2 Me),JAY-Z,2001,11
425,I Just Wanna Love U (Give It 2 Me),JAY-Z,2000,10
426,My First Love,Avant Featuring KeKe Wyatt,2001,11
427,My First Love,Avant Featuring KeKe Wyatt,2000,9
428,So In Love With Two,Mikaila,2001,10
429,So In Love With Two,Mikaila,2000,6
430,Feels Like Love,Vince Gill,2001,2
431,Feels Like Love,Vince Gill,2000,18
432,My Love Goes On And On,Chris Cagle,2000,11
433,Let's Make Love,Faith Hill With Tim McGraw,2000,14
434,It Must Be Love,Alan Jackson,2000,20
435,I Think I'm In Love With You,Jessica Simpson,2000,16
436,You'll Always Be Loved By Me,Brooks & Dunn,2000,19
437,I Will Love Again,Lara Fabian,2000,17
438,When You Need My Love,Darryl Worley,2000,15
439,The Chain Of Love,Clay Walker,2000,20
440,Love's The Only House,Martina McBride,2000,20
441,I'm Outta Love,Anastacia,2000,3
442,I Knew I Loved You,Savage Garden,2000,23
443,I Knew I Loved You,Savage Garden,1999,10
444,Love Sets You Free,Kelly Price & Friends,2000,4
445,U Don't Love Me,Kumbia Kings Featuring A.B. Quintanilla,2000,10
446,If You Don't Wanna Love Me,Tamar Braxton,2000,6
447,He Can't Love U,Jagged Edge,2000,17
448,He Can't Love U,Jagged Edge,1999,3
449,Because You Love Me,Jo Dee Messina,2000,13
450,Love Is Blind,Eve Featuring Faith Evans,2000,16
451,No Leaf Clover,Metallica,2000,10
452,If You Love Me,Mint Condition,2000,12
453,If You Love Me,Mint Condition,1999,8
454,My Love Is Your Love,Whitney Houston,2000,11
455,My Love Is Your Love,Whitney Houston,1999,17
456,I Wanna Love You Forever,Jessica Simpson,2000,9
457,I Wanna Love You Forever,Jessica Simpson,1999,11
458,"Live, Laugh, Love",Clay Walker,2000,7
459,"Live, Laugh, Love",Clay Walker,1999,4
460,Don't Say You Love Me,M2M,2000,6
461,Don't Say You Love Me,M2M,1999,6
462,I Love You,Martina McBride,2000,2
463,I Love You,Martina McBride,1999,18
464,She's In Love,Mark Wills,1999,10
465,If You Had My Love,Jennifer Lopez,1999,25
466,I'll Still Love You More,Trisha Yearwood,1999,12
467,Everyone Falls In Love,Tanto Metro & Devonte,1999,16
468,I Love You Came Too Late,Joey McIntyre,1999,6
469,Crazy Little Thing Called Love,Dwight Yoakam,1999,10
470,If You (Lovin' Me),Silk,1999,20
471,"Luv Me, Luv Me",Shaggy Featuring Janet,1999,15
472,"Luv Me, Luv Me",Shaggy Featuring Janet,1998,2
473,Love Ain't Like That,Faith Hill,1999,8
474,Love Like This,Faith Evans,1999,13
475,Love Like This,Faith Evans,1998,7
476,How Deep Is Your Love,Dru Hill Featuring Redman,1999,8
477,How Deep Is Your Love,Dru Hill Featuring Redman,1998,12
478,Love Me,112 Featuring Mase,1999,6
479,Love Me,112 Featuring Mase,1998,10
480,It Must Be Love,Ty Herndon,1999,6
481,It Must Be Love,Ty Herndon,1998,4
482,How Do You Fall In Love,Alabama,1999,1
483,How Do You Fall In Love,Alabama,1998,4
484,I Still Love You,Next,1998,20
485,Lost In Love,Nastyboy Klick,1998,9
486,I Still Love You,Lil Suzy,1998,1
487,You Only Have To Say You Love Me,Hannah Jones,1998,20
488,The Arms Of The One Who Loves You,Xscape,1998,20
489,Love For Free,Rell Featuring Jay-Z,1998,3
490,Love The Way,EOL,1998,6
491,I Honestly Love You (David Foster Vers.),Olivia Newton-John,1998,12
492,What The World Needs Now Is Love,Dionne Warwick And The Hip-Hop Nation United,1998,2
493,Do For Love,2Pac Featuring Eric Williams,1998,18
494,It's Your Love,She Moves,1998,15
495,Love You Down,INOJ/LATHUN,1998,20
496,If I Never Stop Loving You,David Kersh,1998,16
497,Love Me Good,Michael W. Smith,1998,5
498,All My Love,Queen Pen Featuring Eric Williams,1998,15
499,Show Me Love,Robyn,1998,17
500,Show Me Love,Robyn,1997,7
501,We're Not Making Love No More,Dru Hill,1998,17
502,We're Not Making Love No More,Dru Hill,1997,3
503,Send My Love/Send One Your Love,Born Jamericans,1998,10
504,Don't Be Stupid (You Know I Love You),Shania Twain,1998,12
505,Don't Be Stupid (You Know I Love You),Shania Twain,1997,4
506,I Can Love You Better,Dixie Chicks,1998,7
507,Love Of My Life,Sammy Kershaw,1998,4
508,Love Of My Life,Sammy Kershaw,1997,1
509,My Love Is The Shhh!,Somethin' For The People Featuring Trina & Tamara,1998,8
510,My Love Is The Shhh!,Somethin' For The People Featuring Trina & Tamara,1997,18
511,Love Gets Me Every Time,Shania Twain,1998,8
512,Love Gets Me Every Time,Shania Twain,1997,12
513,Butta Love,Next,1998,6
514,Butta Love,Next,1997,17
515,Rhythm Of Love,DJ Company,1998,2
516,Rhythm Of Love,DJ Company,1997,17
517,Love Is Alive,3rd Party,1997,11
518,I Can Love You,Mary J. Blige,1997,19
519,When Love Starts Talkin',Wynonna,1997,2
520,Four Leaf Clover,Abra Moore,1997,13
521,To Make You Feel My Love,Billy Joel,1997,9
522,Need Your Love,Big Bub Featuring Queen Latifah & Heavy D,1997,5
523,When You Talk About Love,Patti LaBelle,1997,12
524,It's Your Love,Tim McGraw With Faith Hill,1997,20
525,Gimme Some Love,Gina G,1997,11
526,I Love Me Some Him/I Don't Want To,Toni Braxton,1997,20
527,Love II Love,Damage,1997,4
528,Don't Let Go (Love),En Vogue,1997,27
529,Don't Let Go (Love),En Vogue,1996,8
530,Ghetto Love,Da Brat Featuring T-Boz,1997,15
531,It Must Be Love,Robin S.,1997,5
532,Falling In Love (Is Hard On The Knees),Aerosmith,1997,15
533,Without Your Love,Angelina,1997,15
534,I Love You Always Forever,Donna Lewis,1997,13
535,I Love You Always Forever,Donna Lewis,1996,28
536,If We Fall In Love Tonight,Rod Stewart,1997,13
537,If We Fall In Love Tonight,Rod Stewart,1996,7
538,"You Must Love Me (From ""Evita"")",Madonna,1997,13
539,"You Must Love Me (From ""Evita"")",Madonna,1996,7
540,When You Love A Woman,Journey,1997,12
541,When You Love A Woman,Journey,1996,10
542,I'm Still In Love With You,New Edition,1997,12
543,I'm Still In Love With You,New Edition,1996,8
544,Without Love,Donna Lewis,1997,12
545,Without Love,Donna Lewis,1996,3
546,Colour Of Love,Amber,1997,10
547,This Is For The Lover In You,"Babyface Featuring LL Cool J, Howard Hewett, Jody Watley & Jeffrey Daniels",1997,10
548,This Is For The Lover In You,"Babyface Featuring LL Cool J, Howard Hewett, Jody Watley & Jeffrey Daniels",1996,10
